{
  "schemaVersion": "1.0",
  "catalogVersion": 7,
  "tenantId": "demo-tenant",
  "name": "Securities Operations Catalog (excerpt)",
  "description": "Illustrative excerpt covering the entities the v1 journeys need. Shows how business vocabulary, entitlement metadata, aggregation rules and AI grounding hints coexist on one governed artifact.",
  "lifecycleState": "published",

  "domains": {
    "securities": { "businessName": "Securities", "order": 1 },
    "processing": { "businessName": "Data Processing", "order": 2 },
    "dq": { "businessName": "Data Quality", "order": 3 },
    "parties": { "businessName": "Parties", "order": 4 }
  },

  "entities": {
    "securities.security": {
      "id": "securities.security",
      "businessName": "Security",
      "pluralName": "Securities",
      "synonyms": ["instrument", "asset", "issue"],
      "description": "A tradable financial instrument in the security master.",
      "domain": "securities",
      "primaryKey": ["security-id"],
      "labelAttribute": "name",
      "secondaryLabelAttribute": "isin",
      "iconHint": "security",
      "effectiveDating": "bitemporal",
      "logicalDataSourceId": "edm-security-master",
      "rowEntitlementDomain": "edm.security.read",
      "sensitivity": "internal",
      "defaultDetailExperience": "securities.operations",
      "defaultSearchExperience": "securities.operations",
      "cost": { "class": "medium", "typicalRowCount": 2400000, "volatilityTtlSeconds": 300, "requiresFilter": true },
      "aiHints": {
        "whenToUse": "Any question about instruments themselves — identifiers, classification, issuer, status.",
        "exampleQuestions": ["how many new securities were added today", "show me equities missing a SEDOL"]
      },
      "attributes": {
        "security-id": {
          "id": "security-id",
          "businessName": "Security ID",
          "dataType": "identifier",
          "semanticType": "securityId",
          "nullable": false,
          "groupable": false,
          "sensitivity": "internal"
        },
        "isin": {
          "id": "isin",
          "businessName": "ISIN",
          "synonyms": ["international securities identification number"],
          "dataType": "string",
          "semanticType": "isin",
          "searchable": true,
          "groupable": false,
          "sensitivity": "internal"
        },
        "sedol": {
          "id": "sedol",
          "businessName": "SEDOL",
          "dataType": "string",
          "semanticType": "sedol",
          "searchable": true,
          "groupable": false,
          "sensitivity": "internal"
        },
        "name": {
          "id": "name",
          "businessName": "Security Name",
          "dataType": "string",
          "searchable": true,
          "groupable": false,
          "sensitivity": "internal"
        },
        "asset-class": {
          "id": "asset-class",
          "businessName": "Asset Class",
          "synonyms": ["instrument type", "security type"],
          "dataType": "enum",
          "semanticType": "assetClass",
          "sensitivity": "internal",
          "enumValues": [
            { "value": "EQUITY", "label": "Equity", "order": 1 },
            { "value": "BOND", "label": "Bond", "order": 2 },
            { "value": "FUND", "label": "Fund", "order": 3 },
            { "value": "DERIVATIVE", "label": "Derivative", "order": 4 }
          ]
        },
        "currency": {
          "id": "currency",
          "businessName": "Trading Currency",
          "dataType": "string",
          "semanticType": "currencyCode",
          "sensitivity": "internal"
        },
        "status": {
          "id": "status",
          "businessName": "Status",
          "dataType": "enum",
          "semanticType": "statusCode",
          "sensitivity": "internal",
          "enumValues": [
            { "value": "ACTIVE", "label": "Active", "emphasis": "positive" },
            { "value": "PENDING", "label": "Pending Review", "emphasis": "warning" },
            { "value": "MATURED", "label": "Matured", "emphasis": "muted" }
          ]
        },
        "created-at": {
          "id": "created-at",
          "businessName": "Created",
          "dataType": "datetime",
          "sensitivity": "internal"
        },
        "maturity-date": {
          "id": "maturity-date",
          "businessName": "Maturity Date",
          "dataType": "date",
          "nullable": true,
          "sensitivity": "internal"
        },
        "coupon-rate": {
          "id": "coupon-rate",
          "businessName": "Coupon Rate",
          "dataType": "percentage",
          "semanticType": "rate",
          "nullable": true,
          "precision": 9,
          "scale": 6,
          "sensitivity": "internal"
        }
      },
      "measures": {
        "security-count": {
          "id": "security-count",
          "businessName": "Security Count",
          "synonyms": ["number of securities", "instrument count"],
          "valueType": "integer",
          "allowedAggregations": ["count", "countDistinct"],
          "defaultAggregation": "count",
          "higherIsBetter": true,
          "sensitivity": "internal"
        }
      }
    },

    "processing.file-load": {
      "id": "processing.file-load",
      "businessName": "File Load",
      "pluralName": "File Loads",
      "synonyms": ["feed", "inbound file", "data load"],
      "description": "An inbound vendor or client file processed by EDM, with its arrival and completion status.",
      "domain": "processing",
      "primaryKey": ["load-id"],
      "labelAttribute": "file-name",
      "effectiveDating": "effective",
      "logicalDataSourceId": "edm-file-processing",
      "rowEntitlementDomain": "edm.processing.read",
      "sensitivity": "internal",
      "cost": { "class": "low", "typicalRowCount": 5000, "volatilityTtlSeconds": 60 },
      "aiHints": {
        "whenToUse": "Operational questions about today's processing — what arrived, what is late, what failed.",
        "exampleQuestions": ["which files are late today", "show failed loads by source"]
      },
      "attributes": {
        "load-id": { "id": "load-id", "businessName": "Load ID", "dataType": "identifier", "groupable": false, "sensitivity": "internal" },
        "file-name": { "id": "file-name", "businessName": "File Name", "dataType": "string", "semanticType": "fileName", "searchable": true, "groupable": false, "sensitivity": "internal" },
        "source-system": { "id": "source-system", "businessName": "Source", "synonyms": ["vendor", "feed provider"], "dataType": "string", "sensitivity": "internal" },
        "business-date": { "id": "business-date", "businessName": "Business Date", "dataType": "date", "sensitivity": "internal" },
        "expected-at": { "id": "expected-at", "businessName": "Expected By", "dataType": "datetime", "sensitivity": "internal" },
        "completed-at": { "id": "completed-at", "businessName": "Completed", "dataType": "datetime", "nullable": true, "sensitivity": "internal" },
        "load-status": {
          "id": "load-status",
          "businessName": "Status",
          "dataType": "enum",
          "semanticType": "statusCode",
          "sensitivity": "internal",
          "enumValues": [
            { "value": "COMPLETE", "label": "Complete", "emphasis": "positive" },
            { "value": "LATE", "label": "Late", "emphasis": "warning" },
            { "value": "FAILED", "label": "Failed", "emphasis": "negative" },
            { "value": "AWAITING", "label": "Awaiting", "emphasis": "neutral" }
          ]
        },
        "row-count": { "id": "row-count", "businessName": "Rows Processed", "dataType": "integer", "sensitivity": "internal" }
      },
      "measures": {
        "late-file-count": {
          "id": "late-file-count",
          "businessName": "Late Files",
          "synonyms": ["files late", "overdue feeds"],
          "description": "Count of loads past their expected time and not yet complete.",
          "valueType": "integer",
          "allowedAggregations": ["count", "sum"],
          "defaultAggregation": "count",
          "higherIsBetter": false,
          "defaultThresholds": [
            { "id": "ok", "from": 0, "to": 0, "emphasis": "positive" },
            { "id": "watch", "from": 1, "to": 5, "emphasis": "warning" },
            { "id": "breach", "from": 6, "to": null, "emphasis": "negative" }
          ],
          "sensitivity": "internal"
        },
        "failed-file-count": {
          "id": "failed-file-count",
          "businessName": "Failed Files",
          "valueType": "integer",
          "allowedAggregations": ["count", "sum"],
          "defaultAggregation": "count",
          "higherIsBetter": false,
          "defaultThresholds": [
            { "id": "ok", "from": 0, "to": 0, "emphasis": "positive" },
            { "id": "breach", "from": 1, "to": null, "emphasis": "negative" }
          ],
          "sensitivity": "internal"
        },
        "rows-processed": {
          "id": "rows-processed",
          "businessName": "Rows Processed",
          "valueType": "integer",
          "allowedAggregations": ["sum", "avg", "max"],
          "defaultAggregation": "sum",
          "higherIsBetter": true,
          "sensitivity": "internal"
        }
      }
    },

    "dq.exception": {
      "id": "dq.exception",
      "businessName": "Data Quality Exception",
      "pluralName": "Data Quality Exceptions",
      "synonyms": ["exception", "break", "data issue", "validation failure"],
      "description": "An instance of a data quality rule failing for a specific record.",
      "domain": "dq",
      "primaryKey": ["exception-id"],
      "labelAttribute": "rule-name",
      "effectiveDating": "effective",
      "logicalDataSourceId": "edm-dq-exceptions",
      "rowEntitlementDomain": "edm.dq.read",
      "sensitivity": "confidential",
      "defaultDetailExperience": "securities.operations",